{
  "schema_version": 1,
  "status": "active_registry",
  "activation_scope": "child_project",
  "entries": [
    {
      "id": "EVID-000001",
      "claim_or_question": "The current lead engine is a production operations system with explicit US/Canada, Overture, phone-required, R2 dedupe, dated Sheets and daily target constraints.",
      "source_type": "repository",
      "source_ref": "https://github.com/Vertex-Systems-Network/vsn-lead-engine/blob/main/README.md",
      "source_title": "VSN Lead Engine README",
      "publisher_or_owner": "VSN",
      "published_at": null,
      "accessed_at": "2026-10-05",
      "source_revision_or_hash": "main as of ba7a8bcc224f429d5ab85d8cff076a3c9eccffa2",
      "evidence_class": "verified_fact",
      "confidence": "high",
      "summary": "Current runtime and target are already operational; SaaS tenant, subscription and client app capabilities are not evidenced in planning snapshot. Preserve existing invariants.",
      "supports_requirement_ids": [],
      "supports_option_ids": [
        "OPT-LEAD-PROVENANCE",
        "OPT-USER-SCHEDULES"
      ],
      "supports_module_ids": [
        "MOD-PRODUCTION-RUNTIME",
        "MOD-PRODUCT-DISCOVERY"
      ],
      "validation_status": "validated",
      "supersedes": [],
      "notes": [
        "Current-state and README evidence need re-read before each execution."
      ]
    },
    {
      "id": "EVID-000002",
      "claim_or_question": "Places API content generally must not be pre-fetched, cached or stored beyond allowed exceptions; Place IDs are exempt.",
      "source_type": "primary",
      "source_ref": "https://developers.google.com/maps/documentation/places/web-service/policies",
      "source_title": "Policies and attributions for Places API",
      "publisher_or_owner": "Google for Developers",
      "published_at": null,
      "accessed_at": "2026-10-05",
      "source_revision_or_hash": null,
      "evidence_class": "supported_inference",
      "confidence": "high",
      "summary": "Any Google Places adapter requires policy-specific storage/display/attribution behavior; user-visible lead database retention cannot assume Places content may be stored.",
      "supports_requirement_ids": [],
      "supports_option_ids": [
        "OPT-SOURCE-POLICY-CATALOG"
      ],
      "supports_module_ids": [
        "MOD-SOURCE-CATALOG",
        "MOD-LEAD-DATA-WORKFLOW"
      ],
      "validation_status": "unverified",
      "supersedes": [],
      "notes": [
        "Re-open current terms/policies with qualified reviewer before any integration."
      ]
    },
    {
      "id": "EVID-000003",
      "claim_or_question": "Google Maps Platform prices services by SKU and billable usage; usage/free events vary by product.",
      "source_type": "primary",
      "source_ref": "https://developers.google.com/maps/billing-and-pricing/pricing",
      "source_title": "Google Maps Platform pricing list",
      "publisher_or_owner": "Google for Developers",
      "published_at": null,
      "accessed_at": "2026-10-05",
      "source_revision_or_hash": null,
      "evidence_class": "supported_inference",
      "confidence": "high",
      "summary": "A generic paid toggle is inadequate; provider/call-level estimates, budgets and hard caps are required.",
      "supports_requirement_ids": [],
      "supports_option_ids": [
        "OPT-COST-CONTROLS",
        "OPT-PAID-SOURCE-MODE"
      ],
      "supports_module_ids": [
        "MOD-SAAS-BILLING",
        "MOD-SOURCE-CATALOG"
      ],
      "validation_status": "unverified",
      "supersedes": [],
      "notes": [
        "Re-check live rates during provider evaluation; no rate copied into plan."
      ]
    },
    {
      "id": "EVID-000004",
      "claim_or_question": "Apollo publicly presents prospecting, contact data credits, sequences, AI, and analytics.",
      "source_type": "primary",
      "source_ref": "https://www.apollo.io/pricing",
      "source_title": "Apollo public pricing and product overview",
      "publisher_or_owner": "Apollo.io",
      "published_at": null,
      "accessed_at": "2026-10-05",
      "source_revision_or_hash": null,
      "evidence_class": "supported_inference",
      "confidence": "medium",
      "summary": "Public product descriptions indicate an integrated outbound workflow and usage-credit model. Marketing claims do not prove internal implementation or independent efficacy.",
      "supports_requirement_ids": [],
      "supports_option_ids": [
        "OPT-AI-ASSIST",
        "OPT-SUBSCRIPTIONS-ENTITLEMENTS"
      ],
      "supports_module_ids": [
        "MOD-PRODUCT-DISCOVERY"
      ],
      "validation_status": "unverified",
      "supersedes": [],
      "notes": [
        "Detailed UX/pricing/complaint comparison remains pending."
      ]
    },
    {
      "id": "EVID-000005",
      "claim_or_question": "Clay publicly describes enrichment with multiple providers and waterfall ordering.",
      "source_type": "primary",
      "source_ref": "https://university.clay.com/docs/building-a-data-waterfall",
      "source_title": "Building a data waterfall",
      "publisher_or_owner": "Clay",
      "published_at": null,
      "accessed_at": "2026-10-05",
      "source_revision_or_hash": null,
      "evidence_class": "supported_inference",
      "confidence": "medium",
      "summary": "Supports evaluation of provider order, field-level provenance, confidence and cost as product requirements; doesn't prove coverage claims.",
      "supports_requirement_ids": [],
      "supports_option_ids": [
        "OPT-LEAD-PROVENANCE",
        "OPT-COST-CONTROLS"
      ],
      "supports_module_ids": [
        "MOD-PRODUCT-DISCOVERY",
        "MOD-SOURCE-CATALOG"
      ],
      "validation_status": "unverified",
      "supersedes": [],
      "notes": [
        "Independent and user research still needed."
      ]
    },
    {
      "id": "EVID-000006",
      "claim_or_question": "Hunter publicly offers email finding, verification, API access and credit-based plans.",
      "source_type": "primary",
      "source_ref": "https://hunter.io/pricing",
      "source_title": "Hunter plans and pricing",
      "publisher_or_owner": "Hunter",
      "published_at": null,
      "accessed_at": "2026-10-05",
      "source_revision_or_hash": null,
      "evidence_class": "supported_inference",
      "confidence": "medium",
      "summary": "Illustrates focused provider integration and credit-based usage; it does not establish VSN eligibility/resale rights or a selected provider.",
      "supports_requirement_ids": [],
      "supports_option_ids": [
        "OPT-PAID-SOURCE-MODE",
        "OPT-COST-CONTROLS"
      ],
      "supports_module_ids": [
        "MOD-PRODUCT-DISCOVERY",
        "MOD-SOURCE-CATALOG"
      ],
      "validation_status": "unverified",
      "supersedes": [],
      "notes": [
        "Provider's current API terms/prices must be separately researched."
      ]
    },
    {
      "id": "EVID-000007",
      "claim_or_question": "GitHub Marketplace uses purchase and plan-change webhooks to reconcile app entitlements; it only applies if Marketplace distribution is selected.",
      "source_type": "primary",
      "source_ref": "https://docs.github.com/en/apps/github-marketplace/using-the-github-marketplace-api-in-your-app",
      "source_title": "Using the GitHub Marketplace API in your app",
      "publisher_or_owner": "GitHub Docs",
      "published_at": null,
      "accessed_at": "2026-10-05",
      "source_revision_or_hash": null,
      "evidence_class": "supported_inference",
      "confidence": "high",
      "summary": "Billing provider is a product decision; GitHub Marketplace is not a generic consumer SaaS billing substitute.",
      "supports_requirement_ids": [],
      "supports_option_ids": [
        "OPT-SUBSCRIPTIONS-ENTITLEMENTS"
      ],
      "supports_module_ids": [
        "MOD-SAAS-BILLING"
      ],
      "validation_status": "unverified",
      "supersedes": [],
      "notes": [
        "Current listing eligibility and terms require re-check if considered."
      ]
    },
    {
      "id": "EVID-000008",
      "claim_or_question": "Apple supports auto-renewable subscription purchases in-app; storefront rules may differ by jurisdiction and current policy.",
      "source_type": "primary",
      "source_ref": "https://developer.apple.com/app-store/review/guidelines/",
      "source_title": "App Store Review Guidelines",
      "publisher_or_owner": "Apple Developer",
      "published_at": null,
      "accessed_at": "2026-10-05",
      "source_revision_or_hash": null,
      "evidence_class": "supported_inference",
      "confidence": "medium",
      "summary": "Mobile monetization/distribution must be decided and re-verified for intended storefronts before checkout design.",
      "supports_requirement_ids": [],
      "supports_option_ids": [
        "OPT-MOBILE-CLIENT",
        "OPT-SUBSCRIPTIONS-ENTITLEMENTS"
      ],
      "supports_module_ids": [
        "MOD-MOBILE-CLIENT",
        "MOD-SAAS-BILLING"
      ],
      "validation_status": "unverified",
      "supersedes": [],
      "notes": [
        "Region-specific exceptions and requirements need current legal/platform review."
      ]
    },
    {
      "id": "EVID-000009",
      "claim_or_question": "Microsoft Store allows commerce options for non-game PC products and offers its own store commerce path.",
      "source_type": "primary",
      "source_ref": "https://learn.microsoft.com/en-us/windows/apps/publish/get-started",
      "source_title": "Get started with Microsoft Store",
      "publisher_or_owner": "Microsoft Learn",
      "published_at": null,
      "accessed_at": "2026-10-05",
      "source_revision_or_hash": null,
      "evidence_class": "supported_inference",
      "confidence": "medium",
      "summary": "Desktop packaging and payments/distribution model are separate decisions; current Store terms must be checked before selecting a route.",